{
  "schema_version": "cops.agent-mcp-auth-case/v1",
  "case_id": "revoked-grant",
  "title": "Revocation boundary with pre-revocation control at tick two and denial at tick three",
  "grant": "revoked-write",
  "flow": "delegated",
  "attempts": [
    {
      "principal": "principal-alice",
      "agent": "agent-worker",
      "downstream_service": "service-canary",
      "audience": "mcp://auth-fixture",
      "tenant": "tenant-contoso-01",
      "resource": "res-canary",
      "operation": "write",
      "scopes": [
        "canary:write"
      ],
      "depth": 1,
      "tick": 2,
      "tool": "canary/write"
    },
    {
      "principal": "principal-alice",
      "agent": "agent-worker",
      "downstream_service": "service-canary",
      "audience": "mcp://auth-fixture",
      "tenant": "tenant-contoso-01",
      "resource": "res-canary",
      "operation": "write",
      "scopes": [
        "canary:write"
      ],
      "depth": 1,
      "tick": 3,
      "tool": "canary/write"
    }
  ],
  "expected_decisions": [
    "allowed",
    "denied"
  ],
  "expected_effect_count": 1,
  "expected_reasons": [
    "allowed",
    "revoked_grant"
  ]
}
