{
  "schema_version": "cops.agent-mcp-auth-case/v1",
  "case_id": "autonomous-control",
  "title": "Legitimate autonomous service write",
  "grant": "autonomous-write",
  "flow": "autonomous",
  "attempts": [
    {
      "principal": "service-scheduler",
      "agent": "agent-worker",
      "downstream_service": "service-canary",
      "audience": "mcp://auth-fixture",
      "tenant": "tenant-contoso-01",
      "resource": "res-canary",
      "operation": "write",
      "scopes": [
        "canary:write"
      ],
      "depth": 1,
      "tick": 1,
      "tool": "canary/write"
    }
  ],
  "expected_decisions": [
    "allowed"
  ],
  "expected_effect_count": 1,
  "expected_reasons": [
    "allowed"
  ]
}
